,ID,Sentence,disease
3126,528,Aspartate aminotransferase (AST) ≤ 3.0 × ULN,{''}
3127,542,Ocular,{''}
3128,547,Cognitive status of participant is normal (CDR-SB 0).,{''}
3129,549,"LiverTotal serum bilirubin (TBiL) ≤ 1.5 × ULN;AST and ALT ≤ 2.5 × ULN; For subjects with liver metastasis, AST and ALT can be ≤ 5 × ULN;Serum albumin (ALB) ≥ 30g/L;",{'liver'}
3130,557,"Sexually active males or females of childbearing potential must agree to use a highly effective method of contraception throughout the duration of the study. Females of childbearing potential are defined as females who are not surgically sterile or postmenopausal (defined as 12 consecutive months with no menses without an alternative medical cause) as documented in medical history. Highly effective methods of contraception include abstinence; oral, injected, or implanted hormonal methods of contraception; intrauterine device or intrauterine system; condom or occlusive cap (diaphragm or cervical/vault caps) with spermicidal foam/gel/film/cream/suppository; or monogamous intercourse with a partner who is surgically sterile (post-vasectomy, -hysterectomy, or -tubal ligation).",{'h'}
3131,559,Radiation therapy Patients must have had their last (conventional or hypofractionated) fraction of a) Focal irradiation \> 6 months prior to enrollment and b) No prior craniospinal irradiation is permitted.,{''}
3132,566,"MYCN amplification, regardless of age or additional biologic features",{''}
3133,569,Calculated creatinine clearance ≥ 40 cc/min using the Cockcroft-Gault formula,{''}
3134,4,Pelvic lymph node dissection (PLND) is required with either pN0 or pN1 nodal staging permitted.,{''}
3135,10,Post-menopausal aged 45-69 with any of the following three risks factors,{''}
3136,14,Hemoglobin (Hgb) \>= 9 g/dL or \>= 5.6 mmol/L without transfusion or erythropoietin (EPO) dependency (within 7 days of assessment) (performed within 14 days of treatment initiation),{''}
3137,15,Pregnant individuals,{''}
3138,23,Calculated creatinine clearance (CrCl) according to Cockcroft-Gault formula and based on ideal body weight or 24-hour urine CrCl ≥ 50 mL/minute,{''}
3139,27,Plan to change usual diabetes regimen in the next 3 months including before and during participation in the study,{''}
3140,44,-25 years old,{''}
3141,47,"Fluency in DIAN-TU trial approved language and evidence of adequate premorbid intellectual functioning. Participants must be fluent in languages for which cognitive and clinical measures have been translated and validated for use in the DIAN-TU. Fluency is generally defined as daily or frequent functional use of a language generally from birth or a young age. In cultures where multiple languages are spoken or for participants who are multilingual, determination as to whether a participant's level of fluency in languages for which clinical and cognitive measures are available meets qualification for the study should be made by the site PI.",{''}
3142,49,"Patients must have adequate hematological, liver, cardiac and kidney function within 14 days prior to first treatment",{''}
3143,58,Absolute neutrophil count (ANC) ≥ 1.5 x 109/L,{''}
3144,64,Receiving services from an enrolled therapist,{''}
3145,73,"Dose Expansion Group C Participants must either have had prior treatment with at least 1 but no more than 2 taxane regimens, or been deemed ineligible for or refused taxane therapy on consultation with their physician",{''}
3146,74,"Note For B-LLy patients with tissue available for flow cytometry, the criterion for diagnosis should be analogous to B-ALL. For tissue processed by other means (i.e., paraffin blocks), the methodology and criteria for immunophenotypic analysis to establish the diagnosis of B-LLy defined by the submitting institution will be accepted (diagnostic biopsy for B-LLy must be performed within 14 days prior to enrollment).","{'B - LL ##y, B - AL ##L, B - LL ##y, B - LL ##y'}"
3147,75,Patient is living in the community (i.e. not in nursing home); some levels of assisted living may be permitted at the discretion of the investigator.,{''}
3148,76,"Contraindications to vitamin B1, such as liver or kidney dysfunction, or severe neuropsychiatric disorders.","{'liver or kidney d ##ys ##function, ne, ##uro ##psy ##chia ##tric disorders'}"
3149,94,Parent/guardian's able to provide consent for minors,{''}
3150,96,Lenvatinib 30 days,{''}
3151,98,"For patients with stage I or II disease, specimens for rapid central review have been submitted and the rapid central review diagnosis and staging must be available to be provided on the AHEP0731 eligibility case report form (CRF)",{''}
3152,109,Prior radiation to the chest that would overlap with the current radiation fields and determined by the treating physician to impede the treatment of the study malignancy.,"{'ma, ##li'}"
3153,111,Renal Estimated creatinine clearance ≥ 30 mL/min according to the Cockcroft-Gault formula.,{''}
3154,118,Participants may have received no more than a total cumulative RAI dose for treatment (not including RAI given for diagnostic purposes only) of 500 mCi (18.5 GBq).,{''}
3155,122,to \< 90 mL/min per 1.73 m\^2 for participants with mild renal impairment,"{'re, ##nal imp ##air'}"
3156,125,Documented prostate volume (by MRI or ultrasound) \<= 80 cc,{''}
3157,130,Participants are required to receive killed influenza vaccination at least 2 weeks prior to the baseline visit (V0) when vaccine for the current or upcoming flu season is available.,{'flu'}
3158,139,"- Participants are to be Japanese, defined as having both parents and 4 grandparents who are Japanese.",{''}
3159,147,Patients who have passed 24 weeks or more after achieving SVR\* with DAA therapy or IFN therapy.,{''}
3160,148,Participant consent must be appropriately obtained in accordance with applicable local and regulatory requirements. Each participant must sign a consent form prior to enrollment in the trial to document their willingness to participate.,{''}
3161,151,Cohort H The subjects with G/GEJ adenocarcinoma who have received at least prior second-line systemic chemotherapy;,{'G / GE ##J ad ##eno ##car ##cin ##oma'}
3162,157,Subjects who understood the purpose and risks of the questionnaire development and who were well-acquainted with the contents and submitted the written consent to participate in the interview for the questionnaire development.,{''}
3163,159,"Total bilirubin =\< 1.5 ULN (upper limit of normal), unless due to Gilbert's syndrome","{""Gilbert ' s syndrome""}"
3164,161,liver biopsy within 1 year of screening,{''}
3165,162,Aspartate aminotransferase (AST)(serum glutamic oxaloacetic transaminase \[SGOT\])/alanine aminotransferase (ALT)(serum glutamic pyruvic transaminase \[SGPT\]) ≤ 3 x institutional upper limit of normal (ULN) or ≤ 5 x institutional ULN if known liver metastases,{''}
3166,185,Acceptable hematologic parameters.,{''}
3167,187,Performance status ≥ 50% according to Lansky scale (\&amp;lt;16 years old) or Karnofsky scale (for ≥16 years old).,{''}
3168,189,Hepatocellular carcinoma (HCC),"{'He, ##pa ##to ##cellular car ##cin ##oma, HC ##C'}"
3169,190,Resolution of all acute toxic effects of previous anticancer therapy,{''}
3170,197,Are institutionalized or too ill to participate (i.e. mental or nursing home facility or incarcerated),{''}
3171,200,Progressive corneal infection,{''}
3172,204,Acute Pain Trial,{''}
3173,205,"diastolic BP, 50 to 100 mmHg, inclusive",{''}
3174,206,Participant agrees not to participate in another interventional study while participating in the present study.,{''}
3175,221,Absolute Neutrophil Count (ANC) \> 1500mm\^3,{''}
3176,223,ii. Facial acne IGA score of 3 or 4.,"{'F, ##ac ##ial a ##c ##ne'}"
3177,229,Subjects (or legal guardians) must have the ability to understand and the willingness to sign a written informed consent document.,{''}
3178,233,generally healthy with normal fasting glucose levels (glucose ≤100 mg/dL).,{''}
3179,234,"No blood transfusions and no use of cell growth factors and/or platelet-raising drugs during the 14 days prior to the screening period must be allowed, and the organ function level must meet the following criteria",{''}
3180,249,Able to sign informed consent and comply with all study requirements.,{''}
3181,258,Splenic enlargement,"{'S, ##ple ##nic en ##lar ##gement'}"
3182,259,"Participant must be able to take an enteral dose and formulation of medication. Study medication is only available as an oral suspension or tablet, which may be taken by mouth or other enteral route such as nasogastric, jejunostomy, or gastric tube",{''}
3183,261,Normal mammogram report within 2 years of screening.,{''}
3184,265,"-≤90 days from the patient's most recent breast surgery for this breast cancer. Note In cases where registration will occur \>90 days from surgery but within an acceptable time frame, patient may be eligible for enrollment with approval from the PI, Rachel Freedman MD, MPH.",{'breast cancer'}
3185,277,"Adequate bone marrow function neutrophils ≥ 1.5 x 10E9 cells/l, platelets ≥100 x 10E9 cells/l, Hb ≥ 6.2 mmol/l.",{''}
3186,281,N486_P490del,{''}
3187,291,"Willing to sign consent for blood collection onto the Pancreas SPORE, IRB 354-06.",{''}
3188,293,Hydroxychloroquine,{''}
3189,309,Alanine aminotransferase (ALT)/ aspartate aminotransferase (AST) ≤ 2.5 x ULN or ≤ 5 x ULN if hepatic abnormalities are related to underlying liver metastases or liver/biliary primary.,"{'he, ##pa ##tic abnormal ##ities'}"
3190,318,"admitted to non-pediatric hospital medicine services (i.e., intensive care)",{''}
3191,326,"Serum creatinine clearance (CKD-EPI formula) ≥20 mL/min,",{''}
3192,327,Clinical detected nodal melanoma (if single site) arising from an unknown primary.,{'nod ##al me ##lan ##oma'}
3193,328,No diagnosis of a neurological disease.,{'ne ##uro ##logical disease'}
3194,337,"Coronal scanning of head MRI in screening stage the MTA grade of medial temporal lobe atrophy visual assessment scale is grade 1-2. If the subject can provide the head MRI film that meets the requirements within 3 month before screening, it can be used as the basis for enrollment without repeated shooting; If the researcher cannot judge whether the subject's condition has changed, the coronal MRI scan of the head before enrollment can be added;",{'medial temporal lobe at ##rop ##hy'}
3195,340,Patient must not have confirmed or suspected primary mediastinal large B-cell lymphoma (PMBL),"{'media ##st ##inal large B - cell l ##ymph ##oma, PM ##BL'}"
3196,343,ANC ≥ 1.5 X 109/L,{''}
3197,344,Must have no major impairment of bone marrow function (without hematological support within 7 days prior to assessment) Hemoglobin ≥ 9.0 g/dL; complete blood count (CBC) ≥ 2.5 × 109/L; neutrophils ≥ 1.5 × 109/L; platelets ≥ 75 × 109/L.,{''}
3198,346,Following treatment per COG ANBL00P1,{''}
3199,347,Aspartate aminotransferase (AST) (serum glutamic oxaloacetic transaminase \[SGOT\])/alanine aminotransferase (ALT) (serum glutamate pyruvate transaminase \[SGPT\]) =\< 2.5 x institutional ULN or =\< 5 x ULN if metastatic disease involves liver,{''}
3200,350,Body mass index (BMI) ≥18 kg/m2,{''}
3201,352,"At risk of experiencing life-threatening events, such as, shock, myocardial infarction, or stroke, if significant intraoperative or postoperative bleeding occurs (such as in elderly patients or patients with underlying cardiac or pulmonary disease who have limited cardiopulmonary reserve)","{'shock, my ##oc ##ard ##ial in ##far ##ction, stroke, cardiac or pulmonary disease ##pu'}"
3202,356,Serum total bilirubin less than or equal to ≤ 1.5 × ULN or direct bilirubin ≤ ULN for subjects with total bilirubin levels \> 1.5 × ULN,{''}
3203,358,ECOG performance status 0-2 (Appendix 2 - Performance Status Criteria).,{''}
3204,361,\&lt; 2 structured strength training sessions for less than 30 minutes per week in the last month,{''}
3205,362,"Eastern Cooperative Oncology Group (ECOG) performance status of ≤ 1 (Karnofsky ≥ 70%). Both T-DXd (DS-8201a) and azenosertib (ZN-c3) have fatigue as an adverse effect. Due to the overlapping adverse effect, the performance status cannot be less restrictive",{''}
3206,364,"Patients must be medically suitable for study treatments as assessed by the appropriate specialties medical, radiation, and surgical",{''}
3207,367,All persons of childbearing potential must provide samples for urine and serum pregnancy testing prior to enrollment and prior to vaccination. Pregnancy risk assessment and pregnancy prevention counseling will occur at each point of contact.,{''}
3208,371,Ability to understand and willingness to sign a written informed consent document,{''}
3209,385,Cardiac functionNew York Heart Association (NYHA) class \< III;Left ventricular ejection fraction (LVEF) ≥ 50%.,{''}
3210,391,Have a history of allogeneic stem cell transplant or liver transplant,{''}
3211,399,Use of medications that are contraindicated with the study,{''}
3212,414,"Participant has mild (Child-Pugh classification Class A, score 5 or 6) or moderate (Child-Pugh classification Class B, score 7 to 9) hepatic impairment at screening","{'he, ##pa ##tic imp ##air ##ment'}"
3213,415,Anticipation of 3 biliary anastomoses (we will include those anticipated to have 1 or 2 biliary anastomoses as detailed below),{''}
3214,416,years of age or older,{''}
3215,421,Or within 10 years of the age of diagnosis of the youngest PDAC blood relative.,{'PD ##AC'}
3216,425,ii. Facial acne IGA score of 3 or 4.,"{'F, ##ac ##ial a ##c ##ne'}"
3217,426,"Able to read, write, speak, and understand English",{''}
3218,432,Age \>= 18 years,{''}
3219,434,"If a patient screens through OPTIONS #2 or #3, results from previously performed molecular profiling must be submitted following enrollment. It is highly recommended that results be uploaded within 7 days of enrollment (if results are available at time of enrollment) or within 7 days of results becoming available (if pending at time of enrollment) to allow adequate time for central review.",{''}
3220,440,Total bilirubin≤1.5x the upper limit of normal (ULN),{''}
3221,442,Measurable disease per RECIST v1.1 as assessed by BICR or local site investigator.,{''}
3222,457,"In the opinion of the Investigator, the subject can adhere to the visit schedule, to be compliant with the trial treatment regimen and to complete the study.",{''}
3223,458,Hemoglobin ≥9.0 g/dL (with or without blood transfusions). 11. Adequate hepatic and renal function characterized by the following at screening,{''}
3224,466,A male patient must agree to use contraception during the whole study period and for at least 1 week after the last dose of study treatment and refrain from donating sperms during this period,{''}
3225,476,"Women of child-bearing potential and men must agree to use adequate contraception (hormonal or barrier method of birth control; abstinence) prior to study entry, for the duration of study participation, and for 90 days following completion of therapy. Should a woman become pregnant or suspect she is pregnant while participating in this study, she should inform her treating physician immediately",{''}
3226,482,Hemoglobin \>9.0 g/dl (red blood cell/plasma transfusion is not allowed within 2 weeks prior to screening assessment erythropoiesis-stimulating agents/colony- stimulating factors are not allowed within 1 week prior to screening assessment),{''}
3227,513,Able to maintain the visit schedule.,{''}
3228,523,Patients must have a life expectancy ≥ 16 weeks.,{''}
3229,528,Alanine aminotransferase (ALT) ≤ 3.0 × ULN,{''}
3230,547,"Fluency in DIAN-TU trial approved language and evidence of adequate premorbid intellectual functioning. Participants must be fluent in languages for which cognitive and clinical measures have been translated and validated for use in the DIAN-TU. Fluency is generally defined as daily or frequent functional use of a language generally from birth or a young age. In cultures where multiple languages are spoken or for participants who are multilingual, determination as to whether a participant's level of fluency in languages for which clinical and cognitive measures are available meets qualification for the study should be made by the site PI.",{''}
3231,549,"Normal coagulation function, international standardized ratio (INR) ≤ 1.5 x ULN, prothrombin time (PT) and activated partial thromboplastin time (APTT) ≤ 1.5 x ULN;",{''}
3232,559,Corticosteroids Patients receiving dexamethasone must be on a stable or decreasing dose for at least 1 week prior to enrollment,{''}
3233,566,o Patients with INSS stage 4s are eligible with the following,{'IN ##SS 4'}
3234,569,Bilirubin ≤ 1.5 x upper limit of normal (ULN),{''}
3235,4,Subjects must have negative surgical margins or microscopic-only positive surgical margins.,{''}
3236,10,"Dense breasts (BIRADS density categories c-heterogeneously dense or d-extremely dense), or",{''}
3237,14,Creatinine =\< 1.5 x upper limit of normal (ULN) OR measured or calculated creatinine clearance \>= 30 mL/min for subject with creatinine levels \> 1.5 x institutional ULN (performed within 14 days of treatment initiation),{''}
3238,23,Total bilirubin ≤ 1.5 × ULN or direct bilirubin ≤ ULN for participants with total bilirubin levels \> 1.5 × ULN. For participants with Gilbert's disease ≤ 3.0 mg/dL or discussion with the Medical Monitor,"{""Gilbert ' s disease""}"
3239,27,"This would include changing from MDI to pump or from pump to MDI, and starting a CGM if not previously used",{''}
3240,44,Height ≥ 48 inches,{''}
3241,47,Participant has adequate visual and auditory abilities to perform all aspects of the cognitive and clinical assessments.,{''}
3242,49,Absolute neutrophil count (ANC) ≥ 1.5 x 10\^9/L (\> 1500 per mm\^3),{''}
3243,58,Platelet count ≥ 100 x 109/L.,{''}
3244,64,Documented or suspected\* autism diagnosis,{'autism'}
3245,73,Prior treatment with 177Lu-PSMA more than 6 weeks before the start of study treatment is required for participants in Dose Expansion Group C.,{''}
3246,74,All patients and/or their parents or legal guardians must sign a written informed consent.,{''}
3247,75,Pneumococcal pneumonia and shingles vaccines are required within 10 years of Screening (allowed to be performed during Screening but must be given at least 4 weeks prior to initiation of immunosuppressant regimen).,"{'P, ##ne ##um ##oc ##oc ##cal pneumonia, s ##hing ##les'}"
3248,76,"History of total colectomy, with no remaining bowel segments.",{''}
3249,94,Minors aged 12 to 15 in Kenya able to provide assent,{''}
3250,98,"Patients must have a performance status corresponding to Eastern Cooperative Oncology Group (ECOG) scores 0, 1, or 2; use Karnofsky for patients \> 16 years of age and Lansky for patients =\< 16 years of age",{''}
3251,109,Active ongoing pulmonary infection or pneumonitis that is requiring active treatment with antibiotics or steroids. Prior pneumonitis from drug or other therapies that has been treated within 15 days of first day of treatment.,"{'pulmonary infection, p, ##ne ##um ##oni ##tis, p, ##ne ##um ##oni ##tis'}"
3252,118,"Participants must have asymptomatic or minimally symptomatic disease, as judged by the treating investigator. For example, patients with bone metastasis associated with mild pain not requiring narcotics for pain control, or patients with lung metastasis associated with mild cough that does not limit the participant's activities, may be considered minimally symptomatic. If confirmation of this criterion is needed, discussion with the protocol chairperson is required prior to enrollment.","{'bone meta ##sta ##sis, pain, lung meta ##sta ##sis, cough'}"
3253,122,to \< 60 mL/min per 1.73 m\^2 for participants with moderate renal impairment,"{'re, ##nal imp ##air'}"
3254,130,Enrollment must be delayed at least 4 weeks from administration of a killed vaccine other than influenza and COVID-19 and 6 weeks from a live vaccination. Live vaccinations and non-live vaccinations (other than influzena and COVID-19) should not be given while on study drug and be postponed at least 3 months after the last dose of study drug.,{''}
3255,139,Part A3,{''}
3256,147,Patients with Performance Status 0-2.,{''}
3257,148,"Participants must be accessible for treatment and follow-up. Investigators must assure themselves the participants enrolled on this trial will be available for complete documentation of the treatment, adverse events, and follow-up.",{''}
3258,151,Dose expansion study of combination medication (dose expansion part),{''}
3259,159,Aspartate aminotransferase (AST) (serum glutamic-oxaloacetic transaminase \[SGOT\])/alanine aminotransferase (ALT) (serum glutamate pyruvate transaminase \[SGPT\]) =\< 3 x institutional upper limit of normal,{''}
3260,161,Females of childbearing potential must have a negative serum pregnancy test at screening and a negative urine pregnancy test on Day 1 prior to enrolment.,{''}
3261,162,Alkaline phosphatase ≤ 3 x institutional ULN or ≤ 5 x institutional ULN if known liver and/or skeletal metastases,{'liver and / or skeletal meta'}
3262,185,Adequate organ function.,{''}
3263,187,Life expectancy of at least 3 months.,{''}
3264,189,Hepatoblastoma,"{'He, ##pa ##to ##blast ##oma'}"
3265,190,"Female patients must be using highly effective contraceptive measures, and must have a negative pregnancy test prior to start of dosing if of childbearing potential",{''}
3266,197,Have a history of allogeneic stem cell transplant or liver transplant,{''}
3267,200,"Degenerative retinal pathology not allowing visual recovery postoperatively (for the purposes of this study, we accept patients who have had retinal detachment and whose loss of vision is clearly attributable to endothelial decompensation)","{'De ##gene ##rative re ##tina ##l path ##ology, re, ##tina ##l detachment, loss of vision, end ##oth ##eli ##al de ##com ##pen ##sation'}"
3268,204,Undergoing a laparoscopic surgery,{''}
3269,205,"pulse rate, 50 to 110 bpm, inclusive",{''}
3270,221,Hemoglobin ≥ 9 g/dL,{''}
3271,223,"iii. Able to understand the requirements of the study and sign Informed Consent/HIPAA Authorization forms. Subjects under the legal age of consent in the state where the study is conducted must also have the written, informed consent of a parent or legal guardian.",{''}
3272,229,For women of childbearing potential agreement to remain abstinent (refrain from heterosexual intercourse) or use a contraceptive method with a failure rate of \< 1% per year during the treatment period and for at least 90 days after the BAFF CAR-T cell infusion.,{''}
3273,234,Blood routine hemoglobin (HGB) ≥ 90g/L; Absolute neutrophil count (NEUT) ≥ 1.5×10 9 /L; Platelet count (PLT) ≥ 100×10 9 /L;,{''}
3274,249,Life expectancy \> 3 months.,{''}
3275,258,"Risk of compression syndrome (epidural, ureteral, etc)",{'compression syndrome'}
3276,259,Karnofsky \>= 50% for patients \> 16 years of age and Lansky \>= 50% for patients =\< 16 years of age,{''}
3277,261,Normal manual breast examination by investigator at baseline.,{''}
3278,265,ECOG Performance Status (PS) 0-2. See Appendix F.,{''}
3279,277,"Normal liver function bilirubin \< 1.5 x upper limit of the normal range (ULN); alkaline phosphatase \< 2.5 x ULN (\< 5 x ULN in case of liver metastases, and \< 7 x ULN in case of bone metastases); transaminases (ASAT/ALAT) \< 2.5 x ULN (and \< 5 x ULN in case of liver metastases).","{'liver, bone, liver'}"
3280,281,E586K,{''}
3281,291,Able to complete standard of care clinical questionnaire(s) by themselves or with assistance.,{''}
3282,293,Salazosulfapyridine,{''}
3283,309,Absolute neutrophil count (ANC) ≥1500/mm3(without G-CSF in the 2 weeks prior to treatment start),{''}
3284,318,transferred from other hospitals,{''}
3285,326,"Serum SGPT/ALT \<5.0 x Upper Limit of Normal (ULN),",{''}
3286,327,In-transit and/or satellite metastases with regional lymph node involved permitted if considered potentially surgically resectable at baseline.,{''}
3287,328,No intracerebral brain bleeds.,"{'in, ##tra ##cer ##eb ##ral brain bleed'}"
3288,337,"The subjects should have stable and reliable caregivers, who will take care of them at least 3 days a week and at least 4 hours a day. The caregivers will accompany the subjects to participate in the whole process of the study. Caregivers must accompany the subjects to the study visit and assist the investigator in completing the Neuropsychiatric Inventory (NPI), Alzheimer's Disease Collaborative Study-Ability of Daily Living Scale (ADCS-ADL), and Clinician Interview Based Impression of Severity (CIBIC -plus), and other scale scores;","{""Alzheimer ' s Disease""}"
3289,340,Patient must not be pregnant due to the potential harm to an unborn fetus with the treatment regimens being used.,{''}
3290,343,Platelet count ≥ 100 x 109/L,{''}
3291,344,"Must have no major impairment of coagulation status International normalized ratio (INR) ≤ 1.5 × ULN (without anticoagulation therapy), prothrombin time (PT) or activated partial thromboplastin time (aPTT) ≤ ULN.",{'imp ##ment of co ##lation'}
3292,346,Following treatment per CHP 594/Dana-Farber Cancer Institute (DFCI) 34-DAT,{''}
3293,347,Serum creatinine =\< 1.5 x ULN or a calculated creatinine clearance \>= 60 ml/min/1.73 m\^2 (Cockcroft-Gault method) for patients receiving combination of cisplatin and pemetrexed and \>= 45 ml/min/1.73 m\^2 for patients receiving pemetrexed; 24 hour urine for creatinine clearance is acceptable if the calculated creatinine clearance is insufficient,{''}
3294,350,"A female participant is eligible to participate if she is not pregnant, not breastfeeding, and at least one of the following conditions applies",{''}
3295,356,Alanine aminotransferase (ALT) and aspartate aminotransferase (AST) ≤ 2.5 × ULN except for subjects with liver mets for whom ALT and AST should be ≤ 5× ULN,{'liver met'}
