,ID,Sentence,disease
1255,324,No prior systemic anti-cancer therapy for advanced ER+ disease,{''}
1256,325,Involuntary total body weight variation in the last 6 months \< 10%,{''}
1257,326,"Eastern Cooperative Oncology Group (ECOG) performance status 0,1 or 2",{''}
1258,327,Willingness to undergo \[18F\]F-AraG PET imaging at pre- and week 3 timepoints.,{''}
1259,328,"If clinical reports from the time of injury are available and Glasgow Coma Scale scores are available, then 13-15 is considered mild and 9-12 moderate. A clinical neurologist will review the de-identified OSU TBI forms for accuracy and confirm TBI severity.","{'OS ##U, T ##BI, T ##BI'}"
1260,331,"Relapsed after \> or = 3 lines of prior therapy that must include all approved and available therapies deemed eligible by the investigator, inclusing at a minimum of a proteasome inhibitor (PI), an immunomodulatory drug (IMiD), and, where approved and available, a CD38-directed cytolytic antibody in combination in the same line or separate lines of treatment OR refractory to PI, IMiD, and CD38- directed cytolytic antibody,",{''}
1261,332,Eastern Cooperative Oncology Group (ECOG) performance status 0 or 1;,{''}
1262,333,"patients with histologically or cytologically documented locally advanced, advanced, or first recurrent cervical cancer. For treatment-naive patients, 4) no previous cancer treatment including chemotherapy or radiotherapy; Patients with an initial recurrence had not received any other cancer treatment, including chemotherapy or radiotherapy, after the diagnosis of an initial recurrence before enrollment.","{'cancer, cancer'}"
1263,335,Fluent in English,{''}
1264,336,Have signed an IRB consent form agreeing to the terms of the study,{''}
1265,337,"The subjects are primary school graduates / graduates and above, and have the ability to complete the cognitive ability test and other tests specified in the program;",{''}
1266,338,non smoker,{''}
1267,340,"CD10-negative DLBCL, which includes",{'DL ##BC ##L'}
1268,342,Preoperative imaging examination showed L4-5 and L5-S1 responsible segment protrusion or protrusion leading to segment stenosis.,{'segment s ##ten ##osis'}
1269,343,"Patients with a ""targetable"", bidimensionally-measurable, intracranial lesion that is radiographically recurrent after previous treatment with SRS +/- surgery (craniotomy or LITT). To classify a lesion as radiographically progressive, the lesion must demonstrate a ≥ 25% increase in size following treatment based on the Neuro-Oncology Criteria of Tumor Response for CNS Tumors. To be ""targetable"" for this study, the lesion should be coverable through a planned single LITT trajectory and thus have a maximum perpendicular diameter (perpendicular to the laser trajectory) of 3 cm. An intra-operative decision to utilize two trajectories is acceptable and patient may remain on study.","{'in ##c ##al, C ##NS Tu ##mor'}"
1270,344,Must have a primary tumor and/or metastasis amenable for surgery (or tap as indicated).,{''}
1271,345,Total Clinical European League Against Rheumatism Sjogren's Syndrome Disease Activity Index (clinESSDAI) score greater than or equal to (\>=) 6,"{""S ##jo ##gren ' s S ##yn ##drome""}"
1272,346,Following treatment per A3973 protocol,{''}
1273,347,Arm B (first stage of phase II of TRC102 and pemetrexed) patients with malignant pleural or peritoneal mesothelioma who had progressed while being treated with or had recurred within 6 months of being treated with pemetrexed and cisplatin or carboplatin frontline; intervening treatment is allowed,"{'ma, ##li ##gnant p ##le ##ural or per ##ito ##nea ##l me ##so ##the ##lio ##ma'}"
1274,349,"Advanced histologically confirmed breast cancer that is ER+, PgR+, or both, and HER-2 normal;",{'breast cancer'}
1275,350,Smoking history of ≥10 pack-years,{''}
1276,351,"Existence of extrapancreatic organ damage (1) inflammatory bowel disease, (2) impairment of renal function, (3) repeated infection of mouth, skin, anus or whole body, (4) immune hepatitis, (5) persistent chronic immune iridocyclitis, (6) immune adrenalinitis leading to adrenocortical dysfunction, (7) pituitary inflammation leading to hypophysis, (8) rheumatoid disease, (9) immune vasculitis, (10) systemic lupus erythematosus, (11) other organs besides thyroid function damage. Suffering from one or more of above diseases. Recurrence after receiving regular clinical treatment, including symptomatic treatment of organ protective drugs.","{'extra ##pan ##cre ##atic organ, inflammatory bow ##el disease, imp ##air ##ment of re ##nal function infection of mouth , skin , an, immune he ##pa ##titis, chronic immune i ##rid ##oc ##y ##c ##lit ##is, immune ad ##rena ##lini ##tis, ad ##ren ##oc ##ort ##ical d ##ys ##function, pit ##uit ##ary inflammation, h ##y ##pop ##hy ##sis, r ##he ##uma ##to ##id disease, immune v ##as ##cu ##lit ##is, systemic l ##up ##us er ##yt ##hem ##ato ##sus'}"
1277,352,History or documentation of ticagrelor intake within the prior 3 days,{''}
1278,353,"Patient is receiving adjuvant therapy with an aromatase inhibitor (letrozole, anastrozole or exemestane), with or without a CDK4/6 inhibitor abemaciclib, for no more than 18 months,",{''}
1279,354,a. Active disease despite use of standard therapy (i) and one or more additional therapies (ii).,{''}
1280,355,average basal pain intensity (average 7 days) in the lumbar spine on NRS 0-10 ≥2.5,{''}
1281,356,Subjects can be enrolled as (1) TKI naïve or (2) after ≤ 8 weeks of first-line brigatinib treatment without disease progression.,{''}
1282,357,Patient is eligible for Tofacitinib treatment according to Summary of Product Characteristics (SmPC),{''}
1283,358,"Histologically proven, advanced high-grade osteosarcoma not suitable for local treatments with curative intent",{'o ##ste ##osa ##rc ##oma'}
1284,359,"Non-smoker and in good general health, as determined by medical screening evaluation, performed by PI or delegated sub-investigator no greater than 28 days before the first dose in the form of medical history, clinical laboratory tests and physical examination.",{''}
1285,361,"Confirmed by review of the electronic medical record (EMR) and subsequently recorded in Survivor Health History. In cases where the EMR isn't clear, their Oregon Health \&amp; Science University (OHSU) provider will be contacted for confirmation. For non-OHSU patients, we'll initially collect their cancer health history by a self-report questionnaire and confirm when we receive the survivor's outside medical record (through a signed Release of Information)",{'cancer'}
1286,362,T-DXd (DS-8201a)-naive disease,{''}
1287,363,have access to internet and a smart device with a camera and microphone.,{''}
1288,364,≤ 3 metastases in any non-bone organ system,{''}
1289,366,Subject meets the DSM-5 criteria for a primary diagnosis of schizophrenia.,{'s ##chi ##zophrenia'}
1290,367,Demonstrates comprehension of the protocol procedures and knowledge of the trial by passing a written comprehension examination (passing grade \> 70%).,{''}
1291,370,Patients in ASA II-III group,{''}
1292,371,Willingness to use adequate contraception to avoid pregnancy or impregnation for the duration of study participation; Note,{''}
1293,373,Available for the duration of the study,{''}
1294,374,"age greater than 18 years,",{''}
1295,375,Life expectancy of greater than 3 months,{''}
1296,376,Diagnostic and Statistical Manual of Mental Disorder-5 criteria for Alcohol Urge Questionnaire (moderate or severe defined as meeting 4 or more of the 11 criteria) AND a concurrent Diagnostic and Statistical Manual of Mental Disorder-5 recurrent unipolar major depression with HRSD-25 score of 18 or above.,"{'Al U of Mental Di ##sor ##der, un ##ip ##olar major depression'}"
1297,378,Subject has an arteriovenous fistulae (AVF) fistula that was determined to be mature by standard clinical definition,"{'art ##eri ##ove ##nous fist ##ula ##e, A ##V ##F ) fist ##ula'}"
1298,379,Age between 18-80 years old,{''}
1299,380,peripheral saturation (SpO2) strictly inferior to 90% and/or hypercapnic acidosis (pH strictly inferior to 7.35 and pCO2 strictly superior to 45mmHg) on arterial blood gases;,"{'h, ##yper ##cap ##nic acid ##osis'}"
1300,381,Electrocorticogram (ECOG) score ranges from 0 to 1 points;,{''}
1301,382,Hospitalized for acute exacerbation of COPD.,{''}
1302,384,Patient treated with furosemide at least 40 mg in the last 24 hours.,{''}
1303,385,Confirmed PD-L1 expression status (accepts PD-L1 expression test results confirmed by the investigator).,{''}
1304,386,"participants must be willing to use an electronic food diary and consume study provided foods,",{''}
1305,388,Patient with a current DSM-IV diagnosis of moderate or severe major depressive episode (MDE) without psychotic features (based on clinical assessment and confirmed by the MINI interview and the QIDS).,"{'major de ##pressive episode, MD ##E, ##ych'}"
1306,389,The mother has milk,{''}
1307,391,English speaking or Spanish speaking,{''}
1308,392,not seen outside the healthcare system,{''}
1309,394,Hemoglobin A1C less than 9.0%,{''}
1310,395,Bilateral ethmoid disease confirmed on CT,{''}
1311,396,Wants to quit cigarette smoking within the next 30 days (consistent with text messaging intervention trials),{''}
1312,398,scheduled for unilateral mastectomy without immediate breast reconstruction with or without axillary surgery (sentinel lymph node biopsy or axillary lymph node dissection),{''}
1313,399,Currently receiving methadone or buprenorphine treatment for OUD and considered to be stable on current dose for at least 30 days,{'O ##U ##D'}
1314,400,Can be retained to at least 1ml venous blood sample;,{''}
1315,402,Individuals who are normal healthy or have a diabetes diagnosis with a current HbA1c (glycated glucose)\< 7.0.,{'diabetes'}
1316,403,Participants with histologically confirmed diagnosis of a solid tumor (specifications for the different parts of the study below) will be enrolled onto this study,{'solid tumor'}
1317,404,Subjects without significant medical history and currently not on medications that might complicate the results,{''}
1318,405,In Part B eGFR 30-90 ml/min/1.73m\^2 (with no more than 20% having an eGFR \>75 ml/min/1.73m\^2) using CKD-EPI formula at screening visit and at least one historical value of eGFR \<60 mL/min/1.73 m\^2 within 3 months or have a registered diagnostic of CKD.,"{'C, ##K ##D'}"
1319,406,"Symptomatic intracranial arterial stenosis (intracranial segment of internal carotid artery (Petrous segment and above), middle cerebral artery, intracranial segment of vertebral artery, basilar artery, etc.) within 6 months, the degree of stenosis of the diseased artery is between 70% and 99% (WASID method);","{'in ##tra ##c ##rani ##al art ##erial s ##ten ##osis, s ##ten ##osis artery'}"
1320,408,"Histologically confirmed adenocarcinoma of the left colon or rectum (originate in the splenic flexure, descending colon, sigmoid colon, or rectum) in patients with unresectable (not amenable to radical surgery of metastases at the study inclusion) metastatic (M1) disease.","{'ad ##eno ##car ##cin ##oma of the left co ##lon or re, meta'}"
1321,410,Type of Participant and Disease Characteristics,{''}
1322,411,Age between 13-65 years old.,{''}
1323,412,Subject with a Body Mass Index (BMI)\* between 18.5 and 28.0 kg/㎡;,{''}
1324,413,Be willing to adhere to the study intervention through \[18F\]FDG PET/CT or LDCT imaging,{''}
1325,414,Not a woman of childbearing potential (WOCBP),{''}
1326,415,Ability to communicate with investigative staff,{''}
1327,416,Received post-test genetic counseling from MSK Clinical Genetics Service within the last 3 months,{''}
1328,417,The type and dose of drugs used for fibromyalgia should be stable for at least 2 weeks;,"{'fi, ##bro ##my ##al ##gia'}"
1329,418,Obtained written informed consent.,{''}
1330,419,Patient weighing more than 40 kg,{''}
1331,420,"Female or male, aged from 0 to \<20 years (at time of original diagnosis)",{''}
1332,421,"Has relatives in family that contains pancreatic cancer, and carries a known germline mutation in APC, ATM, BRCA1, BRCA2, CDKN2A, EPCAM, MLH1, MSH2, MSH6, PALB2, PMS2, STK11, or TP53.",{'pan ##cre ##atic cancer'}
1333,422,Parents of children under 18 years old,{''}
1334,423,"DSM-5 criteria for opioid use disorder, moderate to severe",{'op ##io ##id use disorder'}
1335,425,A female is considered of childbearing potential unless she is,{''}
1336,426,"Subjects must possess 10-100 total non-inflammatory lesions (open comedones and closed comedones), 10-50 total inflammatory lesions, no cysts, and up to 2 nodules (if deemed appropriate by the PI) on the face.","{'non, inflammatory lesions, c ##ts'}"
1337,427,At least one site of disease 1.5 cm or greater is needed to meet the spatial resolution limits of PET imaging.,{''}
1338,429,Patients attending outpatient clinics in a CS-specialist centre,{'CS'}
1339,431,Patients with HER2-positive breast carcinoma\* (confirmed by a local pathologist).,{'breast car ##cin ##oma'}
1340,432,"Oral cavity, larynx, hypopharynx, or p16-negative oropharynx cancer must be stages T1-2N2-3 or T3N1-3 or T4N0-3 (American Joint Committee on Cancer \[AJCC\] version 8);","{'Oral cavity , la ##ryn ##x , h ##y ##pop ##har ##ynx, or ##op ##har ##ynx cancer'}"
1341,434,Disease Status There are no disease status requirements for enrollment.,{''}
1342,435,Patients with protein energy expenditure (defined by serum albumin \< 3.8 g/dl),{''}
1343,436,"Participants must not have a known diagnosis of obstructive or genetic hypertrophic cardiomyopathy or infiltrative/storage disorder such as cardiac amyloidosis, or any other acute or serious condition that could interfere with assessments during the study or may pose a risk to the participant.","{'o, ##bs ##truct ##ive or genetic h ##yper ##tro ##phic card ##io ##my ##op ##athy, in, ##fi ##lt ##rative / storage disorder, cardiac am ##yl ##oid ##osis'}"
1344,437,All above participants must have completed the written informed consent,{''}
1345,438,Treatment with Diet and Exercise alone at least 90 days prior to day of screening.,{''}
1346,439,Subject is intolerant of positive airway pressure therapy (defined as \<2 hours of sleep time with use per night for at least 5 nights per week as measured objectively by evaluation of continuous positive airway pressure (CPAP) machine memory chip and interpreted by the study sleep medicine specialist),{''}
1347,440,Patients must have consented to surgery with a board-certified Gyn surgeon,{''}
1348,441,All participants must be able to complete the Sonsken logMAR Test (SLT) either verbally or via use of a matching card.,{''}
1349,442,Endometrial cancer,{'End ##ome ##tri ##al cancer'}
1350,443,Diagnosis of MAS according to treating physician in the medical record.,{'MA ##S'}
1351,445,Eastern Cooperative Oncology Group Performance Status of 0 or 1,{''}
1352,446,Participant who had received appropriate prior empiric antibacterial therapy for a carbapenem-resistant pathogen must meet at least 1 of the following criteria no or no more than 24h; worsening of objective symptoms or signs after at least 48 hours of antibacterial therapy; no change of objective symptoms or signs after at least 72 hours of antibacterial therapy.,{''}
1353,449,Have a signed informed consent by participant or surrogate/representative,{''}
1354,450,"-13-year-old male and female students in randomly selected schools with at least 100 students in target classes (year-5 primary, year-1, 2 and 3 secondary)",{''}
1355,452,"Willing to comply with study instructions, agree to make study appointments, and complete the course of the study",{''}
1356,453,Language Proficiency Proficiency in English equivalent to middle school/high school level.,{''}
1357,456,ASA(American Society of Anesthesiologists) ≤ II 4.18kg/m2\<BMI\<30 kg/m2,{''}
1358,457,The subject initiates oral antibiotic treatment in the ambulatory setting.,{''}
1359,458,Presence of a BRAF V600E mutation confirmed as per standard of care according to international guidelines at any time prior to Screening.,{''}
1360,459,Measurement of blood glucose at least 4 times a day,{''}
1361,461,Patient initiating antifungal prophylaxis with micafungin.,{''}
1362,465,BMI greater than 35 to 50 Kg/m2,{''}
1363,466,Patients who are available for the entire trial period and willing to adhere to the protocol requirements,{''}
1364,468,ECOG performance status ≤ 2,{''}
1365,470,Medically fit and willing to undergo resection of disease,{''}
1366,472,Patients with a diagnosis of ALL who are receiving treatment with PEG-asparaginase or inotuzumab ozogamicin with Tbili \> 3 x ULN,{'AL ##L'}
1367,473,English speaker,{''}
1368,474,Participants with TSC associated with renal AML which is eligible for treatment with everolimus per local reimbursement criteria.,"{'T, re ##nal AM ##L'}"
1369,475,Patients whose body weight before operation \> 2 kg;,{''}
1370,476,Patients must have measurable disease at diagnosis per Response Evaluation Criteria In Solid Tumors (RECIST) 1.1,{'Solid Tu ##mor'}
1371,477,Informed consent of parents,{''}
1372,478,Planned elective body reduction surgery to remove excess skin on the abdomen in ≥ 12 to ≤ 18 weeks,{''}
1373,479,Individuals must be ≥ 70 years of age at the time of signing the informed consent form.,{''}
1374,480,At least 1 measurable lesion per Response Evaluation Criteria in solid tumor (RECIST 1.1).,{'solid tumor'}
1375,482,Participants with histologically documented locally advanced or metastatic solid tumor,{''}
1376,483,EDSS score of 6.5 (constant bilateral assistance required to walk about 20 meters without resting) as assessed by a Neurologist with a specialty in MS,{'MS'}
1377,484,"Failed trial of conservative therapy (including bladder training, fluid modification, diet modification, caffeine restriction, or pelvic floor training) -Failed trial of at least one pharmacologic treatment (anticholinergics, β3- adrenoceptor agonist) either due to inability to take the medication, adverse reaction to medication, or no improvement on medication",{''}
1378,485,With an information leaflet and non-opposition form signed by one or both parent(s) or by the legal representative.,{''}
1379,486,"Being between the ages of 18-22,",{''}
1380,489,Stated willingness to comply with all study procedures and availability for the duration of the study;,{''}
1381,490,Signs of histological activity of the NTI objectified during the centralized rereading and defined by,{'N'}
1382,491,Indirect hyperbilirubinemia with TSB levels between 14-20 mg/dL,"{'##dir, h ##yper ##bil ##ir ##ubi ##ne ##mia'}"
1383,492,both partners should have their own mobile devices with access to the internet,{''}
1384,493,Participant fluency in primary language of country in which study is being conducted.,{''}
1385,495,Runs independently,{''}
1386,498,self-identified history of violent victimization,{''}
1387,499,Eastern Cooperative Oncology Group (ECOG) performance status of 0-1.,{''}
1388,500,"Moderately to severely active UC, defined as a baseline modified Mayo score of 5 to 9, inclusive, using the Mayo endoscopic subscore assigned during the concurrent local and central reading of the video endoscopy.",{'UC'}
1389,503,body mass index range 25.0 to 40 kg/m2,{''}
1390,504,Moderate or higher depression confirmed by DIAMOND interview,{''}
1391,505,In regular follow-up in either of the two study centres,{''}
1392,506,Presence of a dental/skeletal malocclusion,{'dental / skeletal ma ##loc ##c ##lusion'}
1393,507,Ability of normal oral ingestion,{''}
1394,510,Patients receiving curative or adjuvant pelvic radiation including,{''}
1395,511,Aged 19-42 years;,{''}
1396,512,"Community dwelling, assisted living conditions or care home residents.",{''}
1397,513,Manifest Refraction - Spherical Equivalent Refractive Error (SERE) at baseline between -0.75 D and -4.00 D inclusive (at the corneal plane) in each eye,{''}
1398,515,"Must, at the time of randomization, be newly initiated on BUP (i.e., within 7 to 28 days) during the current treatment episode, be taking ≥ the recommended target dose for transmucosal BUP57 (or equivalent for extended-release), and have documentation of receiving BUP, including dose and the start date of the current treatment episode, from their BUP provider;",{''}
1399,516,"Those who have listened to a detailed explanation of the clinical trial, fully understand it, voluntarily decide to participate, and provide written consent to comply with precautions.",{''}
1400,517,not taking medication for FM for at least 4 weeks;,{'FM'}
1401,518,years ≤ age ≤ 65 years.,{''}
1402,519,Stable dosing of medications (if taking) for pain and sleep;,{''}
1403,523,Individuals who have ovarian cancer or breast cancer who are recommended to start olaparib,"{'o ##var ##ian cancer, breast cancer'}"
1404,524,Signature of informed consent by the patient or his legal representative,{''}
1405,525,"Decrease in kidney function GFR (or eGFR) less than 60 mL/min, or investigator's decision",{''}
1406,526,Willing to sleep with a weighted blanket for up to 3 months,{''}
1407,527,ability to commit to study visits.,{''}
1408,528,Relapsed/refractory CLL eligible to receive single-agent VEN or VEN in combination with rituximab at Screening.,{'C ##LL'}
1409,529,Members of the tribal communities that participate in the Strong Heart Study in southwestern Oklahoma,{'Strong Heart'}
1410,530,T-NHL PATIENTS,{'T - NHL'}
1411,531,Subjects with severe visual disturbance (count-fingers or worse vision for severe eyes) at the time of obtaining the consent,"{'visual disturbance, count - fingers or, worse vision eyes'}"
1412,532,Patients eligible to receive temozolomide as standard of care adjuvant therapy,{''}
1413,533,Age greater than or equal to 12 years. (Turnstile I),{''}
1414,535,Has a body mass index (BMI) within 18 to 35 kg/m2 and weighs at least 50 kg,{''}
1415,536,Child's parents or guardians are willing and able to give consent,{''}
1416,537,Phototypes l to lV of the Fitzpatrick scale,{''}
1417,538,Subject must have a clinical diagnosis of Rheumatoid Arthritis (RA) at least 6 months prior to Screening,"{'R, ##he ##uma ##to ##id Art ##hr ##itis, RA'}"
1418,539,Stated willingness to comply with all study procedures and availability for the duration of the study,{''}
1419,540,"Living in the same house with their spouse,",{''}
1420,541,Main place of residence in France,{''}
1421,542,Ability to return for all study visits over 48 months,{''}
1422,545,HbA1c ≥ 7.0% and ≤ 10.5% managed with diet and exercise alone or with a stable dose of metformin or an SGLT2 inhibitor for at least one month prior to screening.,{''}
1423,546,years old ≤ 80 years old;,{''}
1424,547,People of childbearing potential,{''}
1425,548,Moderate to severe active Crohn's disease.,"{""C ##ro ##hn ' s disease""}"
1426,549,ECOG physical status score is 0 or 1;,{''}
1427,550,Histologically confirmed recurrent glioblastoma (grade IV) as per WHO criteria 2021 (IDH- wild type only) where the subjects have an Ommaya reservoir in an intralesional cavity of at least 5 mL volume.,"{'g, ##lio ##blast ##oma'}"
1428,551,Normal hearing,{''}
1429,553,Patients who belongs to surgical or trauma subject.,{'trauma'}
1430,554,Part B and Part C Have received 1 to 3 prior lines of anti-myeloma therapy.,{'my ##ma'}
1431,555,"Those who are not currently using Metformin, can tolerate fasting for 8 hours, have not used antibiotics within 3 months, and have no obvious intestinal diseases.","{'in, ##test ##inal diseases'}"
1432,556,"Patients must have been diagnosed between 1990 and 2006 with a clinically localized (clinical stage T1-T3, N0 or NX, MO or MX) prostate cancer, in the judgment of the treating physician","{'pro, ##state cancer'}"
1433,557,"Subjects 50 to 80 years of age, inclusive, on the day of consent.",{''}
1434,558,ICU LOS ≥ 24h,{''}
1435,559,Disease Status Patients must have measurable disease.,{''}
1436,561,"Is male or female ≥18 to ≤85 years of age, inclusive, at screening.",{''}
1437,562,Willingness to comply with study procedures and availability for duration of study,{''}
1438,564,"Female subject must agree not to breastfeed starting at Screening and throughout the study period, and for 60 days after the final study drug administration.",{''}
1439,566,o Patients with International agreement on staging (INSS) stage 4 are eligible with the following,{''}
1440,567,willing to participate the study,{''}
1441,568,the participants were aged between 65 and 95,{''}
1442,569,"ECOG Performance Status of 0, 1 or 2.",{''}
1443,570,Subjects (or their legally acceptable representatives) must have signed an informed consent document indicating that they understand the purpose of and procedures required for the study and are willing to participate in the study,{''}
1444,571,Ability to read and write in English,{''}
1445,1,Presence of fewer than ten intracranial lesions,{'in ##tra ##c ##rani ##al lesions'}
1446,2,Presence of at least 1 non-irradiated tumor lesion detected at conventional imaging (computed tomography / magnetic resonance imaging (CT/MRI)) documented within 4 weeks prior to the 68Ga-NYM096 administration which should be measurable per response evaluation criteria in solid tumors (RECIST) v1.1.,"{'tumor, solid tumors'}"
1447,4,Has no evidence of distant metastases based on PSMA-PET/CT performed ≤28 days prior to enrollment.,{''}
1448,6,Have measureable disease as defined by the Response Evaluation Criteria in Solid Tumors (RECIST 1.1).,{'Solid Tu ##mor'}
1449,7,No psychiatric history and not using medication,{''}
