,ID,Sentence,disease
2225,265,"If node-positive (N1-N3), T1mi, T1a, T1b, T1c, T2, or T3 tumors are eligible (see below for further details on defining node-negative disease) Definition of node-negative disease (when node status known) If the patient has had a negative sentinel node biopsy and/or a negative axillary dissection, then the patient is determined to be node-negative. Axillary nodes with single cells or tumor clusters ≤ 0.2 mm by either H\&E or IHC will be considered node-negative. Any axillary lymph node with tumor clusters between 0.02 and 0.2cm is considered a micrometastasis. Patients with a micrometastasis are eligible even if their tumor is \</= 5mm. An axillary dissection is not required to be performed in patients with a positive sentinel node and management of the axilla will be left up to the treating provider. In cases where the specific pathologic size of lymph node involvement is subject to interpretation, the principal investigator will make the final determination as to eligibility. In these special situations, the investigator must document this approval in the patient medical record.","{'T , T ##2 or T ##3, tumors'}"
2226,267,Speak English or Spanish as a primary language,{''}
2227,270,"No history of neuropathic diseases such as Diabetes Mellitus,","{'ne ##uro ##pathic diseases, Di, ##abe ##tes Mel ##lit ##us'}"
2228,271,"Subjects must be willing to refrain from donating blood, organs, tissues or cells during study participation.",{''}
2229,272,"Myelodysplasia (MDS) IPSS INT-2 or High Risk (i.e. RAEB, RAEBt) or Refractory Anemia with severe pancytopenia, transfusion dependence, or high risk cytogenetics or molecular features.","{'My, ##elo ##dy ##sp ##lasia, MD ##S, IP, An ##emia, pan ##cy ##top ##enia'}"
2230,277,Pretreatment histological biopsy of a metastatic lesion for the translational research questions (tumor tissue from bone metastases cannot be used).,{'tumor'}
2231,278,be willing to participate in the study.,{''}
2232,281,Mechanistically validated activating non-V600 BRAF mutants,{''}
2233,288,Liver ultrasonography showed fatty liver within 24 months before enrollment;,{'fatty liver'}
2234,290,"Acute Lymphoblastic Leukemia (ALL) in first or second remission; Acute Myeloid Leukemia (AML) in first or second remission; Chronic Myelogenous Leukemia (CML) in first chronic or accelerated phase, or in second chronic phase; Hodgkin's and non-Hodgkin's lymphoma; myelodysplastic syndrome","{""A, ##cute L ##ymph ##ob ##lastic Le ##uke ##mia, AL ##L, A, ##cute My ##elo ##id Le ##uke ##mia, AM ##L, Ch, ##ronic My ##elo ##gen ##ous Le ##uke ##mia, C ##ML, Ho, ##d ##g ##kin ' s and non - Ho ##d ##g ##kin ' s l ##ymph ##oma, my, ##elo ##dy ##sp ##lastic syndrome""}"
2235,291,"Note Patients who have received previous chemotherapy for pancreatic cancer are allowed to participate in this study, unless they experienced a previous allergic reaction to the drugs used in this study.","{'pan ##cre ##atic cancer, all'}"
2236,293,≥ 6 swollen joints (using 66-joint assessment),{''}
2237,301,"Are mobile within their home, with or without an assistive device and without physical assistance",{''}
2238,304,CRP of ≥ 0.5 mg/dL or ESR of ≥ 28 mm/h.C-Reactive Protein (CRP) of ≥ 0.8 mg/dL or Erythrocyte Sedimentation Rate (ESR) of ≥ 28 mm/hr,{''}
2239,307,Adequate organ function.,{''}
2240,309,"Expansion cohort B only advanced or metastatic solid tumors with MDM2 or MDM4 amplifications and WT TP53 metastatic for which standard treatment with therapies known to confer a survival benefit does not exist, is no longer effective or tolerated, or the patient declines standard treatment.",{'solid tumors'}
2241,311,ages from 18-50,{''}
2242,313,a non-endometrioid histological type regardless of P53 status.,{''}
2243,315,"Females must be surgically or biologically sterile or postmenopausal (amenorrhoeic for at least 12 months) or if of childbearing potential, must have a negative serum or urine pregnancy test within 72 hours before the start of the treatment. Women of childbearing potential must agree to use an adequate method of contraception during the study and until the last radiation treatment. Males must be surgically or biologically sterile or agree to use an adequate method of contraception during the study and until the last radiation treatment","{'am, ##eno ##rr ##hoe'}"
2244,318,pneumonia,{''}
2245,321,Eligible to receive either product per recommended guidelines at the recommended gestational age and during the recommended seasonal time period. (Maternal RSVpreF from 32 0/7 to 36 6/7 weeks GA from September 1 to January),{''}
2246,324,Eastern Cooperative Oncology Group \[ECOG\] 0-1,{''}
2247,325,Must be able to swallow capsules,{''}
2248,326,"Measurable hematologic disease a dFLC \>20 mg/L with an abnormal κ/λ ratio (with Freelite® test kits, The Binding Site) or presence of a monoclonal spike ≥0.5 g/dL.",{'hem ##ato ##log ##ic disease'}
2249,327,"N1b, or N1c, or N2b, or N2c, or N3b, or N3c and",{''}
2250,328,Signed Informed consent.,{''}
2251,331,Eastern Cooperative Oncology Group (ECOG) Performance Status of ≤ 2,{''}
2252,332,Life expectancy ≥ 12 weeks.,{''}
2253,333,) a negative pregnancy test in a fertile female patient.,{''}
2254,335,"Current hazardous alcohol use (2+ heavy episodic drinking occasions \[4+ drinks on one occasion for women, 5+ drinks on one occasion for men\] in past month, 1+ negative consequences related to alcohol use)",{''}
2255,337,Total score of Clinical Dementia Rating Scale (CDR),{'De ##ment ##ia'}
2256,340,CD10-negative HGBCL with MYC and BCL6 (without BCL2) translocations (HGBCL-DH-BCL6),{''}
2257,343,Frozen pathology diagnosis must be attainable.,{''}
2258,344,Must have a life expectancy estimate of at least 4 months.,{''}
2259,346,Following treatment on New Approaches to Neuroblastoma Therapy (NANT) 2001-02,"{'N, ##eur ##ob ##last ##oma'}"
2260,347,Life expectancy of greater than 3 months,{''}
2261,349,Measurable disease. Patients with non-measurable bone or skin disease as their only manifestation of advanced breast cancer are also eligible;,"{'bone or skin disease, advanced breast cancer'}"
2262,350,"Participant-reported history of signs and symptoms of chronic bronchitis (chronic productive cough for at least 3 months in the year before screening in a participant in whom other causes of chronic cough \[eg, inadequately treated gastroesophageal reflux or chronic rhinosinusitis; or clinical diagnosis of bronchiectasis\] have been excluded).","{'chronic br ##on ##chi ##tis productive cough, chronic cough, gas ##tro ##es ##op ##hage ##al re ##f ##lux, chronic r ##hino ##sin ##us ##itis, br, ##on ##chi ##ec ##tas ##is'}"
2263,352,"Potentially life-threatening bleeding with signs or symptoms of hemodynamic compromise, e.g., systolic blood pressure \< 90 mm Hg and signs or symptoms of low cardiac output not otherwise explained","{'bleeding, hem, ##ody compromise, low cardiac output'}"
2264,353,"Patient understands Slovenian language, and",{''}
2265,354,Subjects must meet organ function criteria,{''}
2266,356,Males or females aged at least 18 years.,{''}
2267,358,"not reside in a field that has been subjected to prior radiotherapy, or",{''}
2268,359,"Women must agree not to become pregnant during the trial. If they are sexually active, they must use an effective method of birth control, e.g. insertable, injectable, transdermal, or combination oral contraceptive approved by Health Canada combined with a barrier contraceptive and have negative results on a serum or urine pregnancy test done before administration of study medication.",{''}
2269,361,Co-residing with an intimate partner or spouse who is willing to participate,{''}
2270,362,"HER2 expression by IHC (1+, 2+, or 3+) or HER2 amplification by ISH or NGS (on any CLIA platform), AND",{''}
2271,364,Bone scan within 42 days of randomization,{''}
2272,367,"Persons of childbearing potential must have used effective birth control methods for at least one month prior to vaccination, and agree to continue with 'per label/fully effective use' for the chosen method for the duration of the study (30 days prior to first vaccination until 12 months after first vaccination), from amongst these",{''}
2273,370,-120kg weight,{''}
2274,371,"Abstinence is only acceptable if it is in line with the preferred and usual lifestyle of the subject; periodic abstinence (e.g., calendar, ovulation, symptothermal, or post-ovulation methods) and withdrawal are not acceptable methods of contraception",{''}
2275,375,Have measurable disease,{''}
2276,376,Increased inflammation (\[serum C-reactive protein\] ≥3.0 mg/L.,{''}
2277,381,Late stage malignant tumor subjects who have failed standard treatment or lack effective treatment；,"{'Late, ma ##li ##gnant tumor'}"
2278,384,"Inferior vena cava (IVC) diameter on ultrasonography ≤21 mm at the time of the ""screening"" visit.",{''}
2279,385,"Cohort 3 HER2 low expression, defined as IHC 1+ or IHC 2+ but ISH or FISH negative.",{''}
2280,388,Patient available for a 4-month follow-up.,{''}
2281,389,Babies who will be examined for ROP for the first time,{'R'}
2282,391,"Currently treated or being considered for treatment with tramadol, hydrocodone, or codeine to improve pain management",{''}
2283,394,Having obtained his/her informed consent,{''}
2284,395,Has been informed of the nature of the study and provided written informed consent,{''}
2285,396,Willing to be randomly assigned to either intervention,{''}
2286,399,Exclusion criteria,{''}
2287,403,Non-small cell lung cancer (NSCLC),"{'Non - small cell lung cancer, N ##SC ##LC'}"
2288,405,"Participant treated with the clinically maximum tolerated dose, as per investigator judgment, of angiotensin-converting enzyme inhibitor (ACEi) or angiotensin receptor blocker (ARB), but not both, for more than 1 month at screening visit.",{''}
2289,406,"Patients with at least 1 risk factor for intracranial atherosclerotic plaque, including previous or existing hypertension, hyperlipidemia, diabetes, smoking;","{'in ##tra ##c ##rani ##al at ##her ##os ##cle ##rot ##ic plaque, h ##yper ##tens ##ion, h ##yper ##lip ##ide ##mia, diabetes'}"
2290,408,At least one unidimensionally measurable lesion per RECIST criteria (version 1.1).,{''}
2291,410,Body weight within 50.0-100.0 kg and BMI within the range 19.0-28.0 kg/m2 (inclusive) at screening.,{''}
2292,414,Female participant must not donate ova starting at dose of IP and throughout the study period and for 28 days after IP administration.,{''}
2293,415,All sexes and genders will be eligible for the study,{''}
2294,416,Has at least one ARR who meets criteria for study enrollment (see below),{''}
2295,419,For controls,{''}
2296,420,Written informed consent of patients and / or parents,{''}
2297,421,OR,{''}
2298,425,Has been surgically sterile for at least 6 months prior to study drug administration.,{''}
2299,426,"Subjects agree not to introduce any new colored cosmetics or skin care products while participating in the study (lipsticks, eye shadows, facial foundations, blush, powder, cleansers, moisturizers).",{''}
2300,427,Patients must be willing to undergo serial imaging procedures.,{''}
2301,431,ECOG performance Status ≤ 1.,{''}
2302,432,Please note A histological or pathological specimen from cervical lymph nodes with well-defined primary site documented clinically or radiologically is acceptable,{''}
2303,434,Patients with a primary spinal tumor are eligible.,{'spinal tumor'}
2304,435,Domicile within the metropolitan area,{''}
2305,440,Patients with stage I-IVA are eligible,{''}
2306,442,Adenocarcinoma or squamous cell carcinoma of the esophagus or advanced/metastatic Siewert type 1 adenocarcinoma of the gastroesophageal junction (GEJ).,"{'Aden ##oc ##ar ##cin ##oma, sq ##ua ##mous cell car ##cin ##oma of the es ##op ##ha ##gus Si ##ew ##ert type 1 ad ##eno ##car ##cin ##oma of the gas ##tro ##es ##op ##hage ##al junction, GE ##J'}"
2307,445,"Advanced or metastatic disease and have received, be refractory to, not be a candidate for, or be intolerant of existing therapies known to provide clinical benefit for the condition of the participant",{'meta'}
2308,457,Cephalosporins,{''}
2309,458,Locally advanced colorectal cancer with initially unresectable but potentially resectable disease according to the local Multidisciplinary Tumour Board (MTB).,"{'color ##ec ##tal cancer, Tu'}"
2310,466,"Combined (estrogen- and progestogen-containing) hormonal contraception associated with inhibition of ovulation (oral, intravaginal, transdermal)",{''}
2311,468,"platelets \>100,000/mcL",{''}
2312,470,"ANC ≥ 1.5 cells/mm3, PLT≥100,000/mm3, PT/aPTT within normal limits at time of surgery",{''}
2313,475,"Patients whose histological features of liver biopsies are reported. HE staining and Masson staining are required, and edema, inflammation, fibrosis, and hyperplasia of intrahepatic bile duct should be reported;","{'ed, inflammation, fi ##bro ##sis, h ##yper ##p ##lasia of in ##tra ##he ##pa ##tic bi ##le duct'}"
2314,476,Performance status Eastern Cooperative Oncology Group (ECOG) 0-1,{''}
2315,478,Females of childbearing potential must be using an approved method of birth control for the past month and during the entire study period. Participants who can become pregnant will undergo a pregnancy test prior to treatment.,{''}
2316,479,Individuals must have been stabilised for at least 24-48h of their HF decompensation before randomisation.,{'H ##F de ##com ##pen ##sation'}
2317,480,Age greater than 18 years (inclusive).,{''}
2318,482,Prior 10 therapy exposure (Cohort 1 only).,{''}
2319,483,No changes to spasticity medications or dalfampridine over the last 3 months,{'spa ##stic ##ity'}
2320,484,No contraindication to undergoing PTNS or TENS therapy,{''}
2321,486,Exclusion criteria,{''}
2322,489,"Male or female, aged 12-17 at time of consenting;",{''}
2323,500,"Participants with inadequate response/non-response, loss of response, or are intolerant of standard biologic therapy for their UC AND/OR Inadequate or non-responders, have shown loss of response, or are intolerant to at least 1 of the following treatments oral corticosteroids (≤20 mg/day), 5-aminosalicylic acid (ASA) compounds, immunomodulators, small molecules.",{'UC'}
2324,504,Provide informed consent,{''}
2325,506,Good compliance during treatment,{''}
2326,510,Bladder cancer,{'B ##lad ##der cancer'}
2327,513,Astigmatism ≤ 0.75 D,{''}
2328,515,"Must not be breastfeeding; if of child bearing potential, must test negative on the study-administered pregnancy test(s), and if of childbearing potential and engaging /planning to engage in sexual intercourse must agree to effective contraception for the duration of the trial through 30 days after the trial; effective contraception is defined as using a) birth control injection, an intrauterine device, or implant; or b) two birth control methods - for example birth control pills with a barrier method (e.g., condoms, etc.). o If ever of childbearing potential, a participant is considered to not be of childbearing potential for the study if they are 1) infertile due to surgical sterilization (hysterectomy, bilateral oophorectomy, tubal implants, or tubal ligation), congenital anomaly such as Mullerian agenesis; are 2) post-menopausal defined as ≥ 55 years old not on hormone therapy, who has had at least 12 months of spontaneous amenorrhea; 3) ≥ 55 years old with a diagnosis of menopause prior to starting hormone replacement therapy; or 4) ≥ 40 years old with an intact uterus, not on hormone therapy, who has cessation of menses for at least 1 year without an alternative medical cause, AND a follicle-stimulating hormone ≥ 40 mIU/mL; participants in this category must test negative on the study-administered pregnancy test(s).","{'##fer, con, ##gen ##ital an ##oma ##ly, Muller ##ian age ##nes ##is, am ##eno ##rr ##hea, men ##op ##aus ##e'}"
2329,523,Absolute neutrophil count (ANC) ≥ 1.5 x 109/L,{''}
2330,525,"Rejection antibody mediated rejection by Banff classification borderline changes or more severe, or investigator's decision",{''}
2331,528,Age ≥ 18 years.,{''}
2332,530,Patients shall have had no prior cytotoxic chemotherapy with the exception of steroids and/or IT cytarabine,{''}
2333,532,"Willing and able to adhere with the protocol for the duration of the study including undergoing treatment, and attending scheduled visits, and examinations",{''}
2334,533,Patients must be HLA-A2 for cohort A. (Turnstile II-Chemotherapy/Cell Infusion-,{''}
2335,536,Child does not have other medical conditions that would preclude the child from completing study assessments.,{''}
2336,538,Subject must be willing and able to comply with the study requirements,{''}
2337,539,Hidradenitis Suppurativa affecting the axilla,{'Hi ##dra ##den ##itis Su ##pp ##ura ##ti ##va'}
2338,540,"Not having sensory losses such as vision or hearing,",{'sensory losses as vision or hearing'}
2339,541,Does not speak French or dementia,{'dem'}
2340,542,"Must meet one of the Genetic Screening Criteria, defined below",{''}
2341,546,"Informed consent, voluntary participation in the trial, and informed consent signed by the subjects themselves.",{''}
2342,547,Must agree not to breastfeed from the time of signed ICF until 5 half-lives after the last dose of any study drug.,{''}
2343,548,A history of at least one of,{''}
2344,549,Expected survival time ≥ 3 months;,{''}
2345,550,Adequate organ function,{''}
2346,556,"While data collection will include review of the reports of any imaging studies of the prostate, bones, or soft tissues, these studies are not essential",{''}
2347,557,Shoulder pain due to OA for \>15 days over the last month (as reported by the subject).,"{'Should ##er pain, O ##A'}"
2348,559,"Performance Level Karnofsky ≥ 50% for patients \> 16 years of age and Lansky ≥ 50 for patients ≤ 16 years of age (See Appendix I). Note Neurologic deficits in patients with CNS tumors must have been stable for at least 7 days prior to study enrollment. Patients who are unable to walk because of paralysis, but who are up in a wheelchair, will be considered ambulatory for the purpose of assessing the performance score.","{'C ##NS tumors, para ##lysis'}"
2349,561,"Male subjects with female partners of childbearing potential must be vasectomized, be willing to use an acceptable method of birth control, or to practice abstinence during the study from check-in until 90 days following Day 21.",{''}
2350,564,"Male subject must not donate sperm starting at Screening and throughout the study period, and for 90 days after the final study drug administration.",{''}
2351,566,"Age 1-18 months, with any of the 3 following unfavorable biologic OR features MYCN amplification, unfavorable pathology, and/or DNA index = 1",{''}
2352,569,"Prior therapy with check-point inhibitors (nivolumab, pembrolizumab, others) and subsequent progressive disease, stable disease or mixed response",{''}
2353,1,Adequate organ and marrow function,{''}
2354,2,For Phase B 68Ga-NYM096 should meet the imaging inclusion criteria,{''}
2355,4,Has a life expectancy \>5 years.,{''}
2356,7,Mothers who volunteer to participate in the research will be included.,{''}
2357,8,Stated willingness and ability to comply with all study procedures and availability for the duration of the study and investigator believes individual will complete the study.,{''}
2358,10,Patients must not have previous personal history of breast cancer including ductal carcinoma in situ,"{'breast cancer, duct ##al car ##cin ##oma in sit ##u'}"
2359,14,Be willing and able to provide written informed consent/assent for the trial,{''}
2360,15,"Heart disease or any other chronic medical condition requiring regular medical therapy including cancer, diabetes, and hypertension.","{'Heart disease, chronic medical condition, cancer, diabetes, h ##yper ##tens ##ion'}"
2361,18,Patient is either not of childbearing potential or must agree not to start a pregnancy from the signature of the informed consent up to the final visit,{''}
2362,19,Interested in wearing contact lenses for approximately 10 hours per day and 6 days per week.,{''}
2363,20,Absence of other clinical contraindications to any part or product of the treatment plan,{''}
2364,23,Adequate organ function as determined by,{''}
2365,24,"Contact lens wearers must demonstrate a stable refraction (within ±0.50 D for both sphere and cylinder) in both eyes, as determined by distance manifest refraction on two consecutive examination dates at least one week apart after discontinuation of contact lens wear.",{''}
2366,27,TH group criterion is that participant must have hardware and internet access capable of 2-way video and audio communication,{''}
2367,29,"In generally good health, in the opinion of the Investigator, other than the underlying chronic pain syndrome",{'chronic pain syndrome'}
2368,34,Males with a partner of childbearing potential must use a condom for the duration of treatment and for at least 48 hours after discontinuing study drug.,{''}
2369,38,Measured body weight within 50 to 130 kg,{''}
2370,43,"Competent to consent for themselves, as determined by a qualified primary care healthcare professional.",{''}
2371,44,Normotensive (\<95th percentile for age; okay if managed with antihypertensive medication),{''}
2372,46,"Patients must be able and willing to read and comprehend written instructions and comprehend and complete the questionnaires required by the protocol (SGRQ, ACQ-5, PGIC and PGIS).",{''}
2373,47,"If partner is not sterilized, must agree to use highly effective contraceptive measuresfrom screening (V1) until 5 half lives after last dose of any study drug",{''}
2374,49,LVEF ≥ 50% on baseline screening ECHO.,{''}
2375,56,bipolar disorder,{'bi ##pol ##ar disorder'}
2376,58,Patients must have measurable disease or evaluable disease in combination with GCIG CA-125 criteria.,{''}
2377,60,At least one measurable lesion meeting the RECIST v1.1 definition was required;,{''}
2378,63,Participant must be ineligible for or refusing a radical cystectomy,{''}
2379,64,Employed at the program for at least the next 12 months,{''}
2380,65,PLUS-M T-score of 55 or above,{''}
2381,68,Severe anxiety or depression,{''}
2382,73,Prior orchiectomy and/or ongoing androgen deprivation therapy and a castrate level of serum testosterone (\<50 ng/dL or \<1.7 nmol/L).,{'or'}
2383,74,B-ALL patients with DS are eligible regardless of the presenting white blood cell count (WBC) (performed within 7 days prior to enrollment).,"{'B - AL ##L, DS'}"
2384,75,Negative screening test for Mycobacterium tuberculosis (MTB) or documented negative MTB test within 1year prior to screening.,"{'My tuberculosis, M ##T, M'}"
2385,76,Exclusion Criteria,{''}
2386,77,"Age 40 or above, ensuring of legal age to give informed consent specific to state and national law",{''}
2387,86,)No obvious hereditary diseases;,{'hereditary diseases'}
2388,93,"Agrees to discuss depression, treatment preferences, and mobile health",{''}
2389,94,Negative pregnancy test for women aged between 13 and 49,{''}
2390,96,"Female participants are not pregnant or breastfeeding and are either not a woman of child-bearing potential (WOCBP) OR use a contraceptive method that is highly effective or are abstinent from heterosexual intercourse during the intervention period and for at least 120 days after the last dose of pembrolizumab or pembrolizumab/quavonlimab, or 30 days after the last dose of lenvatinib, whichever occurs last",{'W'}
2391,97,English speaking,{''}
2392,98,"The patient must have a clinical diagnosis of hepatoblastoma, including an elevated alpha fetoprotein, and must meet all AHEP0731 eligibility criteria at the time of emergent treatment","{'he, ##pa ##to ##blast ##oma'}"
2393,100,An EASI score of ≥16 at screening and at baseline.,{''}
2394,104,-,{''}
2395,105,Adequate hematologic and organ function as indicated by specific laboratory values within 7 days of first dose of study drug,{''}
2396,109,"Females of childbearing potential (FCBP) must have a negative serum pregnancy test within 14 days prior to day 1 of treatment. NOTE Females are considered of child bearing potential unless they are surgically sterile (have undergone a hysterectomy, bilateral tubal ligation, or bilateral oophorectomy) or are postmenopausal (at least 12 consecutive months with no menses without an alternative medical cause).","{'child, FC'}"
2397,111,Performance status ≤2 on the Eastern Cooperative Oncology Group Performance Scale,{''}
2398,117,Women of childbearing potential (WOCBP) must have a negative beta-human chorionic gonadotropin (β-hCG) test and must not be breastfeeding. WOCBP are defined as those who are not surgically sterile or post-menopausal. Female subjects will be considered post-menopausal if they have been amenorrheic for 12 months without an alternative medical cause. Female subjects \< 50 years old who meet the criteria for post-menopausal status without previous surgical sterilization should be considered for further investigation with luteinizing hormone (LH) and follicle stimulating hormone (FSH) levels to confirm serological post-menopausal status.,"{'child ##be, W, ##OC ##P, W, ##OC ##B ##P, am, ##eno ##rr ##he ##ic'}"
2399,118,The malignant tissue does not concentrate RAI on a whole body scan following radioiodine administration,{''}
2400,122,Male participant with female partner(s) of childbearing potential (including breastfeeding partner) must agree to use contraception throughout the treatment period and for 28 days after IP administration.,{''}
2401,125,Able to swallow pills and take medication orally (no documented inability to eat solids and swallow pills) and be willing to adhere to the tice daily regimen of medication (if assigned to the experimental arm).,{''}
2402,130,Body weight ≥ 35kg at screening,{''}
